comment_id,comment_url,commenter_id,commenter_url,commenter_name,commenter_meta,comment_text,comment_time,comment_image,comment_reactors,comment_reactions,comment_reaction_count,replies
317014350453995,https://facebook.com/317014350453995,100063589865349,,Jimmy Lam,,"I got Myocarditis after my 2nd shot.
Please give me exemption.",2022-03-27 00:00:00,,[],,,"[{'comment_id': '317048693783894', 'comment_url': 'https://facebook.com/317048693783894', 'commenter_id': '100063589865349', 'commenter_url': None, 'commenter_name': 'Jimmy Lam', 'commenter_meta': None, 'comment_text': ""Diana Onie\nIt's a permanent heart injury.\nIt'll be a miracle if I can live past 50."", 'comment_time': datetime.datetime(2022, 3, 27, 0, 0), 'comment_image': None, 'comment_reactors': [], 'comment_reactions': None, 'comment_reaction_count': None}, {'comment_id': '317050680450362', 'comment_url': 'https://facebook.com/317050680450362', 'commenter_id': '100063589865349', 'commenter_url': None, 'commenter_name': 'Jimmy Lam', 'commenter_meta': None, 'comment_text': 'Diana Onie\nI went to 24/hrs clinic to ask for exemption memo.\nDid not give me and ask me to take China vaccine.', 'comment_time': datetime.datetime(2022, 3, 27, 0, 0), 'comment_image': None, 'comment_reactors': [], 'comment_reactions': None, 'comment_reaction_count': None}, {'comment_id': '317054647116632', 'comment_url': 'https://facebook.com/317054647116632', 'commenter_id': '100024577680501', 'commenter_url': None, 'commenter_name': 'Kelvin Chan', 'commenter_meta': None, 'comment_text': 'Jimmy Lam many ppl have severe side effects but no doctor will give memo then how to be medical in eligibility? Nonsense', 'comment_time': datetime.datetime(2022, 3, 27, 0, 0), 'comment_image': None, 'comment_reactors': [], 'comment_reactions': None, 'comment_reaction_count': None}, {'comment_id': '317054890449941', 'comment_url': 'https://facebook.com/317054890449941', 'commenter_id': '100024577680501', 'commenter_url': None, 'commenter_name': 'Kelvin Chan', 'commenter_meta': None, 'comment_text': 'Jimmy Lam u cant even take China vaccine they said u no doc memo must take mrna again', 'comment_time': datetime.datetime(2022, 3, 27, 0, 0), 'comment_image': None, 'comment_reactors': [], 'comment_reactions': None, 'comment_reaction_count': None}, {'comment_id': '317057413783022', 'comment_url': 'https://facebook.com/317057413783022', 'commenter_id': '100063589865349', 'commenter_url': None, 'commenter_name': 'Jimmy Lam', 'commenter_meta': None, 'comment_text': 'Kelvin Chan\nThe clinic I went to offers it at $38', 'comment_time': datetime.datetime(2022, 3, 27, 0, 0), 'comment_image': None, 'comment_reactors': [], 'comment_reactions': None, 'comment_reaction_count': None}, {'comment_id': '317066833782080', 'comment_url': 'https://facebook.com/317066833782080', 'commenter_id': '100005191538136', 'commenter_url': None, 'commenter_name': '星月之海', 'commenter_meta': None, 'comment_text': 'Jimmy Lam murderer!', 'comment_time': datetime.datetime(2022, 3, 27, 0, 0), 'comment_image': None, 'comment_reactors': [], 'comment_reactions': None, 'comment_reaction_count': None}, {'comment_id': '317067537115343', 'comment_url': 'https://facebook.com/317067537115343', 'commenter_id': '100005191538136', 'commenter_url': None, 'commenter_name': '星月之海', 'commenter_meta': None, 'comment_text': 'Kelvin Chan MRNA is their agenda, a group of us took Sinovac 3 dose (4g approved) now said your booster must be MRNA, wtf!', 'comment_time': datetime.datetime(2022, 3, 27, 0, 0), 'comment_image': None, 'comment_reactors': [], 'comment_reactions': None, 'comment_reaction_count': None}, {'comment_id': '317069613781802', 'comment_url': 'https://facebook.com/317069613781802', 'commenter_id': '100024577680501', 'commenter_url': None, 'commenter_name': 'Kelvin Chan', 'commenter_meta': None, 'comment_text': '星月之海 they want to force ppl take the mrna clear stocks la', 'comment_time': datetime.datetime(2022, 3, 27, 0, 0), 'comment_image': None, 'comment_reactors': [], 'comment_reactions': None, 'comment_reaction_count': None}, {'comment_id': '317069877115109', 'comment_url': 'https://facebook.com/317069877115109', 'commenter_id': '100024577680501', 'commenter_url': None, 'commenter_name': 'Kelvin Chan', 'commenter_meta': None, 'comment_text': 'Jimmy Chua whats your condition? Heart pain?', 'comment_time': datetime.datetime(2022, 3, 27, 0, 0), 'comment_image': None, 'comment_reactors': [], 'comment_reactions': None, 'comment_reaction_count': None}, {'comment_id': '317362067085890', 'comment_url': 'https://facebook.com/317362067085890', 'commenter_id': '100041125508866', 'commenter_url': None, 'commenter_name': 'Melody Peace', 'commenter_meta': None, 'comment_text': 'Mtf, pls hear what fellow Sgporeans going through. Live and let live. People should have choices to decide what to do with their own health. Cannot indirectly force people. It is really not right. People getting frustrated with you as you know.', 'comment_time': datetime.datetime(2022, 3, 27, 0, 0), 'comment_image': None, 'comment_reactors': [], 'comment_reactions': None, 'comment_reaction_count': None}, {'comment_id': '317867593702004', 'comment_url': 'https://facebook.com/317867593702004', 'commenter_id': '100000290525626', 'commenter_url': None, 'commenter_name': 'Michael Sahai', 'commenter_meta': None, 'comment_text': 'I think of Don McLean’s Vincent last verse -\n‘They would not listen, they’re not listening still.\nPerhaps they never will.’\n\nOne word. Heartless!', 'comment_time': datetime.datetime(2022, 3, 27, 0, 0), 'comment_image': None, 'comment_reactors': [], 'comment_reactions': None, 'comment_reaction_count': None}, {'comment_id': '317923987029698', 'comment_url': 'https://facebook.com/317923987029698', 'commenter_id': '100007542587130', 'commenter_url': None, 'commenter_name': 'Hawken Fox', 'commenter_meta': None, 'comment_text': 'Jimmy Lam Sorry for what happened on your case. Here I post a warning tot hose who still thinking about boosters. Pfizer and morderna mRNA vaccine uses nano lipid particles to deliver the mRNA genetic code into your cell. Since nano lipid particles does not target a particular cell it will go all over your system... blood wall cells, blood cells, liver cells brain cells. After the mRNA genetic code enters the cell it uses your own cell to make spikes of the corona virus. Usually corona virus enter our body through our air passage, nose and into our lungs. But the mRNA vaccine produces the virus inside our human cells everywhere. The problem now would be the cell may need to self destruct creating a type of cykotine storm. Your immune system may become overwhelm and vaccine injuries happens.\n\nBeware of that\'s really going on here. Genetic therapeutic are having very limited test subjects as mRNA is dealing with the genetics manipulation ... They now use the technology and mask it as a ""vaccine"". The world has become the lab and the world population their white mice.', 'comment_time': datetime.datetime(2022, 3, 27, 0, 0), 'comment_image': None, 'comment_reactors': [], 'comment_reactions': None, 'comment_reaction_count': None}, {'comment_id': '318319016990195', 'comment_url': 'https://facebook.com/318319016990195', 'commenter_id': '764418948', 'commenter_url': None, 'commenter_name': 'Hannah Na', 'commenter_meta': None, 'comment_text': 'If this goes on this Gen Singaporeans might be facing extinction soon. Everyone of us should not continue taking so we can have our own freedom back. Now we’re like controlled chickens', 'comment_time': datetime.datetime(2022, 3, 27, 0, 0), 'comment_image': None, 'comment_reactors': [], 'comment_reactions': None, 'comment_reaction_count': None}, {'comment_id': '318345006987596', 'comment_url': 'https://facebook.com/318345006987596', 'commenter_id': '657338722', 'commenter_url': None, 'commenter_name': 'Stephan Roth', 'commenter_meta': None, 'comment_text': ""Hawken Fox Oh no! Edgy medical opinions from a throw-away sock-puppet account with 2 friends... Is this possibly Iris Koh herself?\nIf you want anyone to take your fringe-opinion seriously, then please point to a peer-reviewed study, published in a serious scientific journal.\nJust don't let your own mRNA (which is currently hard at work everywhere in your body helping to transport genetic information needed by your ribosomes as they synthesize proteins) distract you..."", 'comment_time': datetime.datetime(2022, 3, 27, 0, 0), 'comment_image': 'https://scontent.fsin15-2.fna.fbcdn.net/v/t39.30808-6/273712378_10158877023878723_5625984590879926692_n.jpg?stp=cp0_dst-jpg_e15_q65_s180x540&_nc_cat=103&ccb=1-7&_nc_sid=1480c5&_nc_ohc=n-bSMLbFQbkAX86GIAf&_nc_ht=scontent.fsin15-2.fna&oh=00_AfC4gSCSutzb38kiKf9KZkBH6wRNuzBz2vkk1TezjCMliw&oe=64259495', 'comment_reactors': [], 'comment_reactions': None, 'comment_reaction_count': None}, {'comment_id': '318709676951129', 'comment_url': 'https://facebook.com/318709676951129', 'commenter_id': '100033442458776', 'commenter_url': None, 'commenter_name': 'Merrayell Low', 'commenter_meta': None, 'comment_text': 'Jimmy Lam did they confirm? Cos my wife had developed heart complications after second dose but doc refuse to sign off.. hear centre somemore', 'comment_time': datetime.datetime(2022, 3, 27, 0, 0), 'comment_image': None, 'comment_reactors': [], 'comment_reactions': None, 'comment_reaction_count': None}, {'comment_id': '320850013403762', 'comment_url': 'https://facebook.com/320850013403762', 'commenter_id': '100071810490095', 'commenter_url': None, 'commenter_name': 'Benjamin Goh', 'commenter_meta': None, 'comment_text': 'Jimmy Chua in end you foot the medical fees, correct? Pls be more intelligent. Why? Where is the legal letter of whatever compensation during each jab? Does anyone have? No, correct? Why? Govt will not be so foolish to give you a legal paper. Govt will just assure you with words that evapourate in thin air. Govt leaders are not fools!!!!!', 'comment_time': datetime.datetime(2022, 3, 27, 0, 0), 'comment_image': None, 'comment_reactors': [], 'comment_reactions': None, 'comment_reaction_count': None}]"
317102747111822,https://facebook.com/317102747111822,1384518449,,Acyt Chong,,"I'm boosted, and still got infected",2022-03-27 00:00:00,,[],,,[]
317982987023798,https://facebook.com/317982987023798,100063467581870,,Lwin Moe Khaing Kong,,"So after booster, no need wear masks ah? If not, what is the point? I'm so angry and tired after 3 years of COVID nonsense. Like Very angry.",2022-03-27 00:00:00,,[],,,[]
317337100421720,https://facebook.com/317337100421720,100031367353288,,Samsul Alam,,"MOH my name is Alan Md Samsul, already done by vaccinated two dose, so now I want to take booster dose, so plz as soon as possible to arrange for me sir thank you very much",2022-03-27 00:00:00,,[],,,"[{'comment_id': '320860890069341', 'comment_url': 'https://facebook.com/320860890069341', 'commenter_id': '100071810490095', 'commenter_url': None, 'commenter_name': 'Benjamin Goh', 'commenter_meta': None, 'comment_text': 'Samsul Alam bro, money from your job is more, more dear than your life? I can understand now that even the VACCINATED are TRAPPED by more n more booster jabs. Soon people will have serious medical conditions n the hospitals will be making lots of money . So do you see the BIG picture: pay for cheap vaccination first, collect from your Medisave accounts years down the line. Mark my words.', 'comment_time': datetime.datetime(2022, 3, 27, 0, 0), 'comment_image': None, 'comment_reactors': [], 'comment_reactions': None, 'comment_reaction_count': None}]"
317085870446843,https://facebook.com/317085870446843,1649850787,,Gipy Deerg,,Where is the situation report for 7 Feb? How come not releasing?,2022-03-27 00:00:00,,[],,,[]
317032687118828,https://facebook.com/317032687118828,100015302670215,,Mayna San,,When I can get the booster vaccine notif,2022-03-27 00:00:00,,[],,,"[{'comment_id': '320872556734841', 'comment_url': 'https://facebook.com/320872556734841', 'commenter_id': '100071810490095', 'commenter_url': None, 'commenter_name': 'Benjamin Goh', 'commenter_meta': None, 'comment_text': 'Mayna San pls WAKE UP. Still want boosters? Smart or foolish? You decide!!!!!!', 'comment_time': datetime.datetime(2022, 3, 27, 0, 0), 'comment_image': None, 'comment_reactors': [], 'comment_reactions': None, 'comment_reaction_count': None}, {'comment_id': '320876120067818', 'comment_url': 'https://facebook.com/320876120067818', 'commenter_id': '100015302670215', 'commenter_url': None, 'commenter_name': 'Mayna San', 'commenter_meta': None, 'comment_text': 'Benjamin Goh calm sir', 'comment_time': datetime.datetime(2022, 3, 27, 0, 0), 'comment_image': None, 'comment_reactors': [], 'comment_reactions': None, 'comment_reaction_count': None}]"
317833207038776,https://facebook.com/317833207038776,669399846,,Christina Tham,,What blasphemy is this,2022-03-27 00:00:00,,[],,,[]
332141868941243,https://facebook.com/332141868941243,661893042,,Candy Loong,,Booster for what? For me to die ?,2022-03-27 00:00:00,,[],,,[]
317688793719884,https://facebook.com/317688793719884,100000077617590,,Jag Tan,,I asked my IT expert whether I can use a 1st generation antivirus to stop a 3rd generation on my computer. He told me to load the antivirus twice but this did not prevent the virus from infecting my computer. The IT expert told me to load the antivirus a 3rd time to solve the problem! I think he is an IT quack! What do you think?,2022-03-27 00:00:00,,[],,,"[{'comment_id': '317907217031375', 'comment_url': 'https://facebook.com/317907217031375', 'commenter_id': '100007542587130', 'commenter_url': None, 'commenter_name': 'Hawken Fox', 'commenter_meta': None, 'comment_text': ""Jag Tan If they can't think, no analogy can help stupid lar."", 'comment_time': datetime.datetime(2022, 3, 27, 0, 0), 'comment_image': None, 'comment_reactors': [], 'comment_reactions': None, 'comment_reaction_count': None}, {'comment_id': '318230430332387', 'comment_url': 'https://facebook.com/318230430332387', 'commenter_id': '539588667', 'commenter_url': None, 'commenter_name': 'Gwendolyn Yeo', 'commenter_meta': None, 'comment_text': 'Jag Tan this is so so good', 'comment_time': datetime.datetime(2022, 3, 27, 0, 0), 'comment_image': None, 'comment_reactors': [], 'comment_reactions': None, 'comment_reaction_count': None}, {'comment_id': '319573430198087', 'comment_url': 'https://facebook.com/319573430198087', 'commenter_id': '547250893', 'commenter_url': None, 'commenter_name': 'Vivian Wu Songjun', 'commenter_meta': None, 'comment_text': 'Jag Tan great analogy', 'comment_time': datetime.datetime(2022, 3, 27, 0, 0), 'comment_image': None, 'comment_reactors': [], 'comment_reactions': None, 'comment_reaction_count': None}, {'comment_id': '320862786735818', 'comment_url': 'https://facebook.com/320862786735818', 'commenter_id': '100071810490095', 'commenter_url': None, 'commenter_name': 'Benjamin Goh', 'commenter_meta': None, 'comment_text': 'Jag Tan pot calling the cattle black. You hv been fooled n will now be forever be consumed by the ""virus"", not the actual Covid virus which is not the cause of death n adverse medical conditions. Be honest with your intelligent self', 'comment_time': datetime.datetime(2022, 3, 27, 0, 0), 'comment_image': None, 'comment_reactors': [], 'comment_reactions': None, 'comment_reaction_count': None}]"
317348487087248,https://facebook.com/317348487087248,100008869627073,,Jason Wong,,bc Pfizer stock price also needs a booster?,2022-03-27 00:00:00,,[],,,"[{'comment_id': '317711520384278', 'comment_url': 'https://facebook.com/317711520384278', 'commenter_id': '719862818', 'commenter_url': None, 'commenter_name': 'Iris Koh', 'commenter_meta': None, 'comment_text': 'Jason Wong how long do they want to continue fooling the people, thinking we are stupid...', 'comment_time': datetime.datetime(2022, 3, 27, 0, 0), 'comment_image': None, 'comment_reactors': [], 'comment_reactions': None, 'comment_reaction_count': None}, {'comment_id': '317929610362469', 'comment_url': 'https://facebook.com/317929610362469', 'commenter_id': '100007542587130', 'commenter_url': None, 'commenter_name': 'Hawken Fox', 'commenter_meta': None, 'comment_text': ""Iris Koh Sister you should focus the fight and join with the international panel don't bother taking on PAP, they are pawns of the American Pharmaceutical Industry complex. They are not the target. The real target is at the international level. Look for the German team on neureburg 2.0."", 'comment_time': datetime.datetime(2022, 3, 27, 0, 0), 'comment_image': None, 'comment_reactors': [], 'comment_reactions': None, 'comment_reaction_count': None}, {'comment_id': '318162063672557', 'comment_url': 'https://facebook.com/318162063672557', 'commenter_id': '100008869627073', 'commenter_url': None, 'commenter_name': 'Jason Wong', 'commenter_meta': None, 'comment_text': 'Iris Koh One day (soon) when all ppl realize they have been so viciously lied to, the people would rise up and tear them to pieces. ""There will be no future for the wicked."" Stay strong, sister.', 'comment_time': datetime.datetime(2022, 3, 27, 0, 0), 'comment_image': None, 'comment_reactors': [], 'comment_reactions': None, 'comment_reaction_count': None}, {'comment_id': '320855233403240', 'comment_url': 'https://facebook.com/320855233403240', 'commenter_id': '100071810490095', 'commenter_url': None, 'commenter_name': 'Benjamin Goh', 'commenter_meta': None, 'comment_text': 'Jason Wong I would cook n eat all these ""devils"" who manufacture, support n advocate these harmful vaccines. I hv not qualms eating the evil people.', 'comment_time': datetime.datetime(2022, 3, 27, 0, 0), 'comment_image': None, 'comment_reactors': [], 'comment_reactions': None, 'comment_reaction_count': None}]"
317606763728087,https://facebook.com/317606763728087,719862818,,Iris Koh,,How many boosters are lined up? Please be upfront and honest with the people.,2022-03-27 00:00:00,,[],,,"[{'comment_id': '317931087028988', 'comment_url': 'https://facebook.com/317931087028988', 'commenter_id': '100007542587130', 'commenter_url': None, 'commenter_name': 'Hawken Fox', 'commenter_meta': None, 'comment_text': ""Iris Koh never ending , simply because they chose coronavirus that mutates pretty much every year. They can swing stories and fear till the cow comes home. Jab till you drop and laugh their way to the bank robbing tax payer's money."", 'comment_time': datetime.datetime(2022, 3, 27, 0, 0), 'comment_image': None, 'comment_reactors': [], 'comment_reactions': None, 'comment_reaction_count': None}, {'comment_id': '317967357025361', 'comment_url': 'https://facebook.com/317967357025361', 'commenter_id': '100000290525626', 'commenter_url': None, 'commenter_name': 'Michael Sahai', 'commenter_meta': None, 'comment_text': ""From Billy Joel’s Honesty -\n\nIf you search for tenderness\nIt isn't hard to find\nYou can have the love you need to live\nBut if you look for truthfulness\nYou might just as well be blind\nIt always seems to be so hard to give\n\nHonesty is such a lonely word\nEveryone is so untrue\nHonesty is hardly ever heard\nAnd mostly what I need from you\n\n‘Everyone is so untrue’ … well, qualify that as everyone who has an agenda."", 'comment_time': datetime.datetime(2022, 3, 27, 0, 0), 'comment_image': None, 'comment_reactors': [], 'comment_reactions': None, 'comment_reaction_count': None}, {'comment_id': '320873710068059', 'comment_url': 'https://facebook.com/320873710068059', 'commenter_id': '100071810490095', 'commenter_url': None, 'commenter_name': 'Benjamin Goh', 'commenter_meta': None, 'comment_text': 'Iris Koh Can Sporeans really trust our leaders . Sporeans know these pappies too well for ,50+ yrs now', 'comment_time': datetime.datetime(2022, 3, 27, 0, 0), 'comment_image': None, 'comment_reactors': [], 'comment_reactions': None, 'comment_reaction_count': None}, {'comment_id': '320874806734616', 'comment_url': 'https://facebook.com/320874806734616', 'commenter_id': '100071810490095', 'commenter_url': None, 'commenter_name': 'Benjamin Goh', 'commenter_meta': None, 'comment_text': 'Hawken Fox the whole big picture is about MONEY by enslaving the mass population. Think of your furure medical bills. Your Medisave money matters to these ""devils"".', 'comment_time': datetime.datetime(2022, 3, 27, 0, 0), 'comment_image': None, 'comment_reactors': [], 'comment_reactions': None, 'comment_reaction_count': None}]"
317607590394671,https://facebook.com/317607590394671,100012343997715,,Bahtiar Affendy Erna,,💯🇸🇬👍🏻👍🏽👍👍🏼🎯,2022-03-27 00:00:00,,[],,,[]
317205533768210,https://facebook.com/317205533768210,100002368693929,,Shah Nizam,,"Thursday booster
Sunday positive

Please advise MOH?",2022-03-27 00:00:00,,[],,,"[{'comment_id': '318373696984727', 'comment_url': 'https://facebook.com/318373696984727', 'commenter_id': '551377406', 'commenter_url': None, 'commenter_name': 'Joseph Tan', 'commenter_meta': None, 'comment_text': 'Shah Nizam it boosts your chance of getting infected!\n\nBecause what you really want is to be infected, so that you can develop natural immunity 🤡', 'comment_time': datetime.datetime(2022, 3, 27, 0, 0), 'comment_image': None, 'comment_reactors': [], 'comment_reactions': None, 'comment_reaction_count': None}, {'comment_id': '320844930070937', 'comment_url': 'https://facebook.com/320844930070937', 'commenter_id': '100071810490095', 'commenter_url': None, 'commenter_name': 'Benjamin Goh', 'commenter_meta': None, 'comment_text': 'Shah Nizam SUE MOH, lor!', 'comment_time': datetime.datetime(2022, 3, 27, 0, 0), 'comment_image': None, 'comment_reactors': [], 'comment_reactions': None, 'comment_reaction_count': None}]"
317021053786658,https://facebook.com/317021053786658,100046047135678,,Jasmine Poh,,"Can upgrade or not? Give turbocharged instead of booster only. Double the dose, don't be stingy with vaccine",2022-03-27 00:00:00,,[],,,"[{'comment_id': '320843723404391', 'comment_url': 'https://facebook.com/320843723404391', 'commenter_id': '100071810490095', 'commenter_url': None, 'commenter_name': 'Benjamin Goh', 'commenter_meta': None, 'comment_text': 'Jasmine Poh better to be SAFE than more booster shots that we do harm to your natural immune system. Pls Google for more info rgd harmful effects of these experimental vaccines.', 'comment_time': datetime.datetime(2022, 3, 27, 0, 0), 'comment_image': None, 'comment_reactors': [], 'comment_reactions': None, 'comment_reaction_count': None}]"
317034943785269,https://facebook.com/317034943785269,1065824748,,Isabella Bratz,,"For people who do not want to get ""better protection"", can they skip boosters and be allowed to live a normal life instead of being treated like social pariah? Just curious.",2022-03-27 00:00:00,,[],,,"[{'comment_id': '320876690067761', 'comment_url': 'https://facebook.com/320876690067761', 'commenter_id': '100071810490095', 'commenter_url': None, 'commenter_name': 'Benjamin Goh', 'commenter_meta': None, 'comment_text': 'Isabella Bratz Wait long, long until Opposition side forms the govt. Unlikely cos the cowardly PAP keeps tweaking the political rules in their favour, like increasing the number of parliamentary seats, WHATEVER.No end to it all these 50+ yrs under PAP.', 'comment_time': datetime.datetime(2022, 3, 27, 0, 0), 'comment_image': None, 'comment_reactors': [], 'comment_reactions': None, 'comment_reaction_count': None}]"
317727807049316,https://facebook.com/317727807049316,100055831552276,,Jay Jay,,"Take your booster as soon as you are eligible!Before
you lose your job and cant go to shopping mall.Your health dont matter as the current as the booster is not working and daddy pfizer is clearing way for omicron variant coming soon. so ppl get the snake oil made for the alpha variant to keep your vacc passport.",2022-03-27 00:00:00,,[],,,"[{'comment_id': '320878290067601', 'comment_url': 'https://facebook.com/320878290067601', 'commenter_id': '100071810490095', 'commenter_url': None, 'commenter_name': 'Benjamin Goh', 'commenter_meta': None, 'comment_text': 'Jay Jay snake oil or "" snake oil,"" ? Which, for clarification?', 'comment_time': datetime.datetime(2022, 3, 27, 0, 0), 'comment_image': None, 'comment_reactors': [], 'comment_reactions': None, 'comment_reaction_count': None}]"
319364463552317,https://facebook.com/319364463552317,535852230,,Paul Lim,,"A very important and excellent video on how Pfizer grossly manipulated the trials to cover up all the harmful side effects of the vaccine, presented by a group of 500 Canadian doctors and scientists.",2022-03-27 00:00:00,,[],,,[]
317493767072720,https://facebook.com/317493767072720,633048570,,Max Wang,,"Hi MOH, is it true that Singapore have signed a secret contract with Pfizer? Do you have the details of this contract?",2022-03-27 00:00:00,,[],,,"[{'comment_id': '317969697025127', 'comment_url': 'https://facebook.com/317969697025127', 'commenter_id': '100000290525626', 'commenter_url': None, 'commenter_name': 'Michael Sahai', 'commenter_meta': None, 'comment_text': 'You’re asking for secret to be leaked? Pray! Because only divine intervention can help us!', 'comment_time': datetime.datetime(2022, 3, 27, 0, 0), 'comment_image': None, 'comment_reactors': [], 'comment_reactions': None, 'comment_reaction_count': None}]"
