comment_id,comment_url,commenter_id,commenter_url,commenter_name,commenter_meta,comment_text,comment_time,comment_image,comment_reactors,comment_reactions,comment_reaction_count,replies
317035183785245,https://facebook.com/317035183785245,100000299329701,,欣颖,,I have friend who took booster liao then kenna covid. End up now lost his taste and smell. Like tt consider mild symptoms?! 🤔,2022-03-27 00:00:00,,[],,,"[{'comment_id': '317036297118467', 'comment_url': 'https://facebook.com/317036297118467', 'commenter_id': '728717079', 'commenter_url': None, 'commenter_name': 'Yap Chia', 'commenter_meta': None, 'comment_text': ""欣颖 my cousin also same as your friend, few months already still lost his smell.\nMoh will say all not related to vaccine. Don't speculate.\nNo Moh people got such problem? All very healthy, because they jab booster every day?"", 'comment_time': datetime.datetime(2022, 3, 27, 0, 0), 'comment_image': None, 'comment_reactors': [], 'comment_reactions': None, 'comment_reaction_count': None}, {'comment_id': '317044207117676', 'comment_url': 'https://facebook.com/317044207117676', 'commenter_id': '100000299329701', 'commenter_url': None, 'commenter_name': '欣颖', 'commenter_meta': None, 'comment_text': 'Yap Chia oh.. So ur cousin got see doctor? Coz now helping my friend to find ways to get the taste n smell back.', 'comment_time': datetime.datetime(2022, 3, 27, 0, 0), 'comment_image': None, 'comment_reactors': [], 'comment_reactions': None, 'comment_reaction_count': None}, {'comment_id': '317045627117534', 'comment_url': 'https://facebook.com/317045627117534', 'commenter_id': '728717079', 'commenter_url': None, 'commenter_name': 'Yap Chia', 'commenter_meta': None, 'comment_text': '欣颖 He was in hospital for few days, he got some heart problem, no so serious but may not due to vaccine. 😂\nHe is 40+.', 'comment_time': datetime.datetime(2022, 3, 27, 0, 0), 'comment_image': None, 'comment_reactors': [], 'comment_reactions': None, 'comment_reaction_count': None}, {'comment_id': '317046097117487', 'comment_url': 'https://facebook.com/317046097117487', 'commenter_id': '728717079', 'commenter_url': None, 'commenter_name': 'Yap Chia', 'commenter_meta': None, 'comment_text': '欣颖 At least his taste is ok.', 'comment_time': datetime.datetime(2022, 3, 27, 0, 0), 'comment_image': None, 'comment_reactors': [], 'comment_reactions': None, 'comment_reaction_count': None}, {'comment_id': '317046923784071', 'comment_url': 'https://facebook.com/317046923784071', 'commenter_id': '728717079', 'commenter_url': None, 'commenter_name': 'Yap Chia', 'commenter_meta': None, 'comment_text': ""欣颖 So they say vaxed if infected not serious, but they didn't say people may have some side effects from covid.\nWe also don't know whether got vaccine long term side effects after few years."", 'comment_time': datetime.datetime(2022, 3, 27, 0, 0), 'comment_image': None, 'comment_reactors': [], 'comment_reactions': None, 'comment_reaction_count': None}, {'comment_id': '317054063783357', 'comment_url': 'https://facebook.com/317054063783357', 'commenter_id': '100000299329701', 'commenter_url': None, 'commenter_name': '欣颖', 'commenter_meta': None, 'comment_text': 'Yap Chia ah... I see. My friend is a healthy individual. Seldom fall sick kind. 30+ only', 'comment_time': datetime.datetime(2022, 3, 27, 0, 0), 'comment_image': None, 'comment_reactors': [], 'comment_reactions': None, 'comment_reaction_count': None}, {'comment_id': '317055147116582', 'comment_url': 'https://facebook.com/317055147116582', 'commenter_id': '100024577680501', 'commenter_url': None, 'commenter_name': 'Kelvin Chan', 'commenter_meta': None, 'comment_text': '欣颖 most kenal are those taken the vaccine lo', 'comment_time': datetime.datetime(2022, 3, 27, 0, 0), 'comment_image': None, 'comment_reactors': [], 'comment_reactions': None, 'comment_reaction_count': None}, {'comment_id': '317060280449402', 'comment_url': 'https://facebook.com/317060280449402', 'commenter_id': '100000316210117', 'commenter_url': None, 'commenter_name': 'Klein Yeoman', 'commenter_meta': None, 'comment_text': 'Why our ministers and their family members didn\'t catch the virus even though they are jabbed three times? Why only we, the ""commoners""?', 'comment_time': datetime.datetime(2022, 3, 27, 0, 0), 'comment_image': None, 'comment_reactors': [], 'comment_reactions': None, 'comment_reaction_count': None}, {'comment_id': '317060887116008', 'comment_url': 'https://facebook.com/317060887116008', 'commenter_id': '728717079', 'commenter_url': None, 'commenter_name': 'Yap Chia', 'commenter_meta': None, 'comment_text': 'Klein Yeoman Most likely they jab every five minutes, look at oyk, so healthy, so moh, we also want to jab every five minutes.', 'comment_time': datetime.datetime(2022, 3, 27, 0, 0), 'comment_image': None, 'comment_reactors': [], 'comment_reactions': None, 'comment_reaction_count': None}, {'comment_id': '317066223782141', 'comment_url': 'https://facebook.com/317066223782141', 'commenter_id': '100005191538136', 'commenter_url': None, 'commenter_name': '星月之海', 'commenter_meta': None, 'comment_text': 'Yap Chia underlying issue 🤣they die die will not admit!', 'comment_time': datetime.datetime(2022, 3, 27, 0, 0), 'comment_image': None, 'comment_reactors': [], 'comment_reactions': None, 'comment_reaction_count': None}, {'comment_id': '317066957115401', 'comment_url': 'https://facebook.com/317066957115401', 'commenter_id': '728717079', 'commenter_url': None, 'commenter_name': 'Yap Chia', 'commenter_meta': None, 'comment_text': ""星月之海 If they admitted, they scare people don't take booster, one more booster coming soon, who want to take? Or one booster every year?"", 'comment_time': datetime.datetime(2022, 3, 27, 0, 0), 'comment_image': None, 'comment_reactors': [], 'comment_reactions': None, 'comment_reaction_count': None}, {'comment_id': '317080500447380', 'comment_url': 'https://facebook.com/317080500447380', 'commenter_id': '100005191538136', 'commenter_url': None, 'commenter_name': '星月之海', 'commenter_meta': None, 'comment_text': '欣颖 Same, 2 of my friends bros in their 50s, after Pfizer vaccine pass away!', 'comment_time': datetime.datetime(2022, 3, 27, 0, 0), 'comment_image': None, 'comment_reactors': [], 'comment_reactions': None, 'comment_reaction_count': None}, {'comment_id': '320869896735107', 'comment_url': 'https://facebook.com/320869896735107', 'commenter_id': '100071810490095', 'commenter_url': None, 'commenter_name': 'Benjamin Goh', 'commenter_meta': None, 'comment_text': 'Yap Chia luckily I m still stubborn n refuse to be vaccinated. My red blood cells are low in count n could be more dangerous ( oxygen is carried by red blood cells to various parts of body. So dangerous for people like me known as Thalassemia minor).', 'comment_time': datetime.datetime(2022, 3, 27, 0, 0), 'comment_image': None, 'comment_reactors': [], 'comment_reactions': None, 'comment_reaction_count': None}]"
317876963701067,https://facebook.com/317876963701067,718559038,,Jeff Koh,,MOH and MMTF should abide by and respect the National Pledge and ensure justice and equality for all.,2022-03-27 00:00:00,,[],,,"[{'comment_id': '320836063405157', 'comment_url': 'https://facebook.com/320836063405157', 'commenter_id': '100071810490095', 'commenter_url': None, 'commenter_name': 'Benjamin Goh', 'commenter_meta': None, 'comment_text': 'Jeff Koh the reality: power speaks louder, power means whatever you say n do is beyond dispute n must be accepted n carried out. Is this the ""MAJULAH SINGAPURA THAT SPOREANS BEEN SINGING JUST FOR FUN "". I NOW BELIEVE IT IS ! WHY? THE FUMBLING BY SPORE LEADERS N EVEN THE WORLD LEADERS IN HANDLING THIS BY WORLDWIDE COVID PANDEMIC.', 'comment_time': datetime.datetime(2022, 3, 27, 0, 0), 'comment_image': None, 'comment_reactors': [], 'comment_reactions': None, 'comment_reaction_count': None}]"
317041373784626,https://facebook.com/317041373784626,100004245510607,,Derrick Ong,,"Several countries in europe are dropping vaccine pass, when are you going to drop the VDS discrimination?",2022-03-27 00:00:00,,[],,,"[{'comment_id': '317074570447973', 'comment_url': 'https://facebook.com/317074570447973', 'commenter_id': '1121654636', 'commenter_url': None, 'commenter_name': 'Philip Chua CH', 'commenter_meta': None, 'comment_text': 'Derrick Ong Sg depends on Pharma companies like Pfizer to set up factory and give employment/\ninvestment. Dun think will give up mandatory vax that soon...sort of like is a deal to exchange.', 'comment_time': datetime.datetime(2022, 3, 27, 0, 0), 'comment_image': None, 'comment_reactors': [], 'comment_reactions': None, 'comment_reaction_count': None}, {'comment_id': '320868273401936', 'comment_url': 'https://facebook.com/320868273401936', 'commenter_id': '100071810490095', 'commenter_url': None, 'commenter_name': 'Benjamin Goh', 'commenter_meta': None, 'comment_text': 'Derrick Ong WHEN ALL THE VACCINATED WAKE UP COS THEY ARE STILL SLEEPING.THESE VACCINES MAKE THEM DROWSY, NUMB THEIR BRAIN CELLS!!!!!', 'comment_time': datetime.datetime(2022, 3, 27, 0, 0), 'comment_image': None, 'comment_reactors': [], 'comment_reactions': None, 'comment_reaction_count': None}]"
317043067117790,https://facebook.com/317043067117790,100017881200494,,Xiu Yue,,so after 14 Feb status changed and cannot lunch out for elderly..,2022-03-27 00:00:00,,[],,,[]
317026660452764,https://facebook.com/317026660452764,565843705,,Desmond Chua,,Can i bring my 12 year old son without any appointments to vaccine centre to vaccine ?,2022-03-27 00:00:00,,[],,,"[{'comment_id': '317055260449904', 'comment_url': 'https://facebook.com/317055260449904', 'commenter_id': '100024577680501', 'commenter_url': None, 'commenter_name': 'Kelvin Chan', 'commenter_meta': None, 'comment_text': 'Desmond Chua brainless', 'comment_time': datetime.datetime(2022, 3, 27, 0, 0), 'comment_image': None, 'comment_reactors': [], 'comment_reactions': None, 'comment_reaction_count': None}, {'comment_id': '317055567116540', 'comment_url': 'https://facebook.com/317055567116540', 'commenter_id': '565843705', 'commenter_url': None, 'commenter_name': 'Desmond Chua', 'commenter_meta': None, 'comment_text': 'Kelvin Chan please be constructive. U r equally brainless when u reacted with your comment. 🙂', 'comment_time': datetime.datetime(2022, 3, 27, 0, 0), 'comment_image': None, 'comment_reactors': [], 'comment_reactions': None, 'comment_reaction_count': None}, {'comment_id': '317055877116509', 'comment_url': 'https://facebook.com/317055877116509', 'commenter_id': '100024577680501', 'commenter_url': None, 'commenter_name': 'Kelvin Chan', 'commenter_meta': None, 'comment_text': 'Desmond Chua remember to sign the consent anything happen to your kids after vaccine u be full responsibility fool', 'comment_time': datetime.datetime(2022, 3, 27, 0, 0), 'comment_image': None, 'comment_reactors': [], 'comment_reactions': None, 'comment_reaction_count': None}, {'comment_id': '317069743781789', 'comment_url': 'https://facebook.com/317069743781789', 'commenter_id': '100005191538136', 'commenter_url': None, 'commenter_name': '星月之海', 'commenter_meta': None, 'comment_text': ""Desmond Chua Better wait for Document or msg , my colleague took 2 Sinovac, later before 3 month he took Sinopharm, end up not recorded, he just went to Convention Hall that day, all doctor big hoo har, finally they void the Sinopharm record, what a joke, vaccine alr injected can void in Doc, they want him to take MRNA, he rejected, but took Sinovac to complete full Jab status, but next booster will be MRNA they reminded him, MOH very messy, becareful, so received msg then go, don't proactive 🙏life is in our hand not their!"", 'comment_time': datetime.datetime(2022, 3, 27, 0, 0), 'comment_image': None, 'comment_reactors': [], 'comment_reactions': None, 'comment_reaction_count': None}, {'comment_id': '317070150448415', 'comment_url': 'https://facebook.com/317070150448415', 'commenter_id': '565843705', 'commenter_url': None, 'commenter_name': 'Desmond Chua', 'commenter_meta': None, 'comment_text': '星月之海 thanks, life is really precious.', 'comment_time': datetime.datetime(2022, 3, 27, 0, 0), 'comment_image': None, 'comment_reactors': [], 'comment_reactions': None, 'comment_reaction_count': None}, {'comment_id': '317081370447293', 'comment_url': 'https://facebook.com/317081370447293', 'commenter_id': '100005191538136', 'commenter_url': None, 'commenter_name': '星月之海', 'commenter_meta': None, 'comment_text': 'Kelvin Chan Even Prc ppl know that Sg Gamen will pay 250k if they go Holland after MRNA vaccination.', 'comment_time': datetime.datetime(2022, 3, 27, 0, 0), 'comment_image': None, 'comment_reactors': [], 'comment_reactions': None, 'comment_reaction_count': None}, {'comment_id': '317618557060241', 'comment_url': 'https://facebook.com/317618557060241', 'commenter_id': '617091525', 'commenter_url': None, 'commenter_name': 'Pri Ya', 'commenter_meta': None, 'comment_text': 'Desmond Chua children DO NOT NEED these jabs. The risks outweigh the benefits. This is what the world data is showing again and again. What are you going to say to your son when he gets sick from this jab?', 'comment_time': datetime.datetime(2022, 3, 27, 0, 0), 'comment_image': None, 'comment_reactors': [], 'comment_reactions': None, 'comment_reaction_count': None}, {'comment_id': '318344170321013', 'comment_url': 'https://facebook.com/318344170321013', 'commenter_id': '722085219', 'commenter_url': None, 'commenter_name': 'Jeremy Ho', 'commenter_meta': None, 'comment_text': 'Got higher risk of inflame heart and blood clots', 'comment_time': datetime.datetime(2022, 3, 27, 0, 0), 'comment_image': None, 'comment_reactors': [], 'comment_reactions': None, 'comment_reaction_count': None}, {'comment_id': '320586110096819', 'comment_url': 'https://facebook.com/320586110096819', 'commenter_id': '100001405119571', 'commenter_url': None, 'commenter_name': 'Angelia Ng', 'commenter_meta': None, 'comment_text': 'Desmond Chua there is a section for those who choose to walk in. However, it is a longer wait than those with appointments.', 'comment_time': datetime.datetime(2022, 3, 27, 0, 0), 'comment_image': None, 'comment_reactors': [], 'comment_reactions': None, 'comment_reaction_count': None}, {'comment_id': '320846093404154', 'comment_url': 'https://facebook.com/320846093404154', 'commenter_id': '100071810490095', 'commenter_url': None, 'commenter_name': 'Benjamin Goh', 'commenter_meta': None, 'comment_text': 'Desmond Chua what a clown father. Sending your to die or possible adverse medical conditions in the future? Pls think thru trillion times , seek opinions n more advice', 'comment_time': datetime.datetime(2022, 3, 27, 0, 0), 'comment_image': None, 'comment_reactors': [], 'comment_reactions': None, 'comment_reaction_count': None}, {'comment_id': '320847896737307', 'comment_url': 'https://facebook.com/320847896737307', 'commenter_id': '100071810490095', 'commenter_url': None, 'commenter_name': 'Benjamin Goh', 'commenter_meta': None, 'comment_text': ""星月之海 aiyah. You people sure don't understand that once govt has signed purchase agreements for these vaccines, no way to cancel. Govt can be sued for trillions of dollars for breaking agreements. So, so very simple. Pls exercise critical thinking, people,!!!!!!!"", 'comment_time': datetime.datetime(2022, 3, 27, 0, 0), 'comment_image': None, 'comment_reactors': [], 'comment_reactions': None, 'comment_reaction_count': None}, {'comment_id': '320919080063522', 'comment_url': 'https://facebook.com/320919080063522', 'commenter_id': '565843705', 'commenter_url': None, 'commenter_name': 'Desmond Chua', 'commenter_meta': None, 'comment_text': 'Benjamin Goh haha!', 'comment_time': datetime.datetime(2022, 3, 27, 0, 0), 'comment_image': None, 'comment_reactors': [], 'comment_reactions': None, 'comment_reaction_count': None}, {'comment_id': '320994336722663', 'comment_url': 'https://facebook.com/320994336722663', 'commenter_id': '100071810490095', 'commenter_url': None, 'commenter_name': 'Benjamin Goh', 'commenter_meta': None, 'comment_text': ""Desmond Chua bro, seems clear you just laugh it off means very much that you dont even value ur kid's life."", 'comment_time': datetime.datetime(2022, 3, 27, 0, 0), 'comment_image': None, 'comment_reactors': [], 'comment_reactions': None, 'comment_reaction_count': None}, {'comment_id': '320995486722548', 'comment_url': 'https://facebook.com/320995486722548', 'commenter_id': '100071810490095', 'commenter_url': None, 'commenter_name': 'Benjamin Goh', 'commenter_meta': None, 'comment_text': 'Desmond Chua whatever that may come ur direction, let it be. Will be tedious to argue with you.', 'comment_time': datetime.datetime(2022, 3, 27, 0, 0), 'comment_image': None, 'comment_reactors': [], 'comment_reactions': None, 'comment_reaction_count': None}, {'comment_id': '321010503387713', 'comment_url': 'https://facebook.com/321010503387713', 'commenter_id': '565843705', 'commenter_url': None, 'commenter_name': 'Desmond Chua', 'commenter_meta': None, 'comment_text': 'Benjamin Goh i choose to laugh it off, because i know there will be no end to it. Anyway Cheers.', 'comment_time': datetime.datetime(2022, 3, 27, 0, 0), 'comment_image': None, 'comment_reactors': [], 'comment_reactions': None, 'comment_reaction_count': None}]"
318729373615826,https://facebook.com/318729373615826,1648237321,,Shan Shan Khoo,,"Every time we agree to a booster, we are letting go of more of our rights.

Give them and inch and they will take a yard.

Very soon we will be left with nothing, no freedom, no health.",2022-03-27 00:00:00,,[],,,[]
317055370449893,https://facebook.com/317055370449893,1264292040,,Florence Ng,,Hope can receive more ART test kit !,2022-03-27 00:00:00,,[],,,"[{'comment_id': '320837380071692', 'comment_url': 'https://facebook.com/320837380071692', 'commenter_id': '100071810490095', 'commenter_url': None, 'commenter_name': 'Benjamin Goh', 'commenter_meta': None, 'comment_text': 'Florence Ng No need ART cos 9 out of 10 probably are Covid positive. Pls Google for more info which govt leaders of the world wud not tell you.', 'comment_time': datetime.datetime(2022, 3, 27, 0, 0), 'comment_image': None, 'comment_reactors': [], 'comment_reactions': None, 'comment_reaction_count': None}]"
317075947114502,https://facebook.com/317075947114502,1160524157,,첸바오링,,"U, dint even update my status. I, already taken my boosters during last yr Dec. U got the cheek to even remind me to take my booster when ur system failed to update my actually fully vaccinated status.",2022-03-27 00:00:00,,[],,,"[{'comment_id': '320842470071183', 'comment_url': 'https://facebook.com/320842470071183', 'commenter_id': '100071810490095', 'commenter_url': None, 'commenter_name': 'Benjamin Goh', 'commenter_meta': None, 'comment_text': '첸바오링 here is one of the fumbles. In fact a hardcopy, to certify each shot, be signed by the doctor n given during each jab. Dont let govt officials get away by saying that it is too cumbersome to implement, etc.Utter rubbish. Too many lame excuses given by people who avoid any legal liability.', 'comment_time': datetime.datetime(2022, 3, 27, 0, 0), 'comment_image': None, 'comment_reactors': [], 'comment_reactions': None, 'comment_reaction_count': None}]"
318499580305472,https://facebook.com/318499580305472,100009842596270,,Mav Maverick,,"Something .... no, MANY things are terribly, terribly, terribly, terribly terribly, terribly WRONG and EVIL about our ruling political leaders. What's got into them??? 🤔🤔🤔",2022-03-27 00:00:00,,[],,,"[{'comment_id': '320857093403054', 'comment_url': 'https://facebook.com/320857093403054', 'commenter_id': '100071810490095', 'commenter_url': None, 'commenter_name': 'Benjamin Goh', 'commenter_meta': None, 'comment_text': 'Mav Maverick these are the REAL ALIENS humans have been searching for. Now we know who they are. May the wrath of GOD be upon them. GOD said, "" never even throw crumbs to these people in your midst for they are the agents of the big DEVIL "".', 'comment_time': datetime.datetime(2022, 3, 27, 0, 0), 'comment_image': None, 'comment_reactors': [], 'comment_reactions': None, 'comment_reaction_count': None}]"
317554120400018,https://facebook.com/317554120400018,712515734,,Ricky Ds,,Eerr... did anyone get a second and 3rd and 4th.. comparison with incident report studies from those overseas? The reports are totally opposite to what is being stated here... Go research on your own... you will be amazed! Its not surprising that there will be a 4th and 5th and many more boosters with more excuses..🤪,2022-03-27 00:00:00,,[],,,"[{'comment_id': '320844520070978', 'comment_url': 'https://facebook.com/320844520070978', 'commenter_id': '100071810490095', 'commenter_url': None, 'commenter_name': 'Benjamin Goh', 'commenter_meta': None, 'comment_text': 'Ricky Ds 👍👍👍👍 Very honest n down to earth . People,pls take heed', 'comment_time': datetime.datetime(2022, 3, 27, 0, 0), 'comment_image': None, 'comment_reactors': [], 'comment_reactions': None, 'comment_reaction_count': None}, {'comment_id': '320874546734642', 'comment_url': 'https://facebook.com/320874546734642', 'commenter_id': '712515734', 'commenter_url': None, 'commenter_name': 'Ricky Ds', 'commenter_meta': None, 'comment_text': 'Benjamin Goh Sad to say, many are either not bothered to research or have fear to find out the truth or just too brain washed to even dare believe the scientific facts out that. Cant blame them as the mainstream media, news portals, social media have only the main focus of information. Thus people have been condition to trust such information providers. The truth and knowledge is power and many do not want such power to be free to all, cause they might find themselves out of a job! And a major lost to they piggy bank!', 'comment_time': datetime.datetime(2022, 3, 27, 0, 0), 'comment_image': None, 'comment_reactors': [], 'comment_reactions': None, 'comment_reaction_count': None}]"
317685097053587,https://facebook.com/317685097053587,1391816289,,Joel Koh,,MOH how long do you want to carry on this clown show? How long do you want to sweep vax injuries under the carpet?,2022-03-27 00:00:00,,[],,,[]
