comment_id,comment_url,commenter_id,commenter_url,commenter_name,commenter_meta,comment_text,comment_time,comment_image,comment_reactors,comment_reactions,comment_reaction_count,replies
317028020452628,https://facebook.com/317028020452628,1643484934,,Aaron Yong,,"Garbage boosters. I had my 2nd shot, got covid just 2 weeks back, and recovered without issue. Symptoms were nothing more than a bad throat infection and lost of taste. If you're a young adult, You don't need it. That's why some European countries have begun rolling back their mandates. I'd say we're already late in this game.",2022-03-27 00:00:00,,[],,,"[{'comment_id': '317036043785159', 'comment_url': 'https://facebook.com/317036043785159', 'commenter_id': '100004883351317', 'commenter_url': None, 'commenter_name': 'Tan Yi Fang', 'commenter_meta': None, 'comment_text': 'Aaron Yong common sense is not common. Ministry of Health, Singapore wants the young to risk their future health, with this vaccine that has no long term studies.', 'comment_time': datetime.datetime(2022, 3, 27, 0, 0), 'comment_image': None, 'comment_reactors': [], 'comment_reactions': None, 'comment_reaction_count': None}, {'comment_id': '317054290450001', 'comment_url': 'https://facebook.com/317054290450001', 'commenter_id': '100024577680501', 'commenter_url': None, 'commenter_name': 'Kelvin Chan', 'commenter_meta': None, 'comment_text': 'Aaron Yong they just want to clear stocks la', 'comment_time': datetime.datetime(2022, 3, 27, 0, 0), 'comment_image': None, 'comment_reactors': [], 'comment_reactions': None, 'comment_reaction_count': None}, {'comment_id': '317057203783043', 'comment_url': 'https://facebook.com/317057203783043', 'commenter_id': '100000316210117', 'commenter_url': None, 'commenter_name': 'Klein Yeoman', 'commenter_meta': None, 'comment_text': 'Aaron Yong MOH should let people test if they have antibodies against the virus first before asking people to Jab!', 'comment_time': datetime.datetime(2022, 3, 27, 0, 0), 'comment_image': None, 'comment_reactors': [], 'comment_reactions': None, 'comment_reaction_count': None}, {'comment_id': '317057327116364', 'comment_url': 'https://facebook.com/317057327116364', 'commenter_id': '100000316210117', 'commenter_url': None, 'commenter_name': 'Klein Yeoman', 'commenter_meta': None, 'comment_text': 'Kelvin Chan Serving America propaganda?', 'comment_time': datetime.datetime(2022, 3, 27, 0, 0), 'comment_image': None, 'comment_reactors': [], 'comment_reactions': None, 'comment_reaction_count': None}, {'comment_id': '317064070449023', 'comment_url': 'https://facebook.com/317064070449023', 'commenter_id': '100005191538136', 'commenter_url': None, 'commenter_name': '星月之海', 'commenter_meta': None, 'comment_text': 'Klein Yeoman Cannot lah, all will be high anti - bodies.', 'comment_time': datetime.datetime(2022, 3, 27, 0, 0), 'comment_image': None, 'comment_reactors': [], 'comment_reactions': None, 'comment_reaction_count': None}, {'comment_id': '317065527115544', 'comment_url': 'https://facebook.com/317065527115544', 'commenter_id': '100005191538136', 'commenter_url': None, 'commenter_name': '星月之海', 'commenter_meta': None, 'comment_text': 'Keep pushing MRNA, why? Cos Germen Bio N Tech and French Big Pharma Sanofi coming to invest, they will be producing more MRNA stuff, so need to show investors sg all love MRNA.', 'comment_time': datetime.datetime(2022, 3, 27, 0, 0), 'comment_image': None, 'comment_reactors': [], 'comment_reactions': None, 'comment_reaction_count': None}, {'comment_id': '317102640445166', 'comment_url': 'https://facebook.com/317102640445166', 'commenter_id': '100003566175899', 'commenter_url': None, 'commenter_name': 'Ang Teck Huat', 'commenter_meta': None, 'comment_text': 'Be thankful. If not for the booster, you probably lying in the hospital.', 'comment_time': datetime.datetime(2022, 3, 27, 0, 0), 'comment_image': None, 'comment_reactors': [], 'comment_reactions': None, 'comment_reaction_count': None}, {'comment_id': '317148280440602', 'comment_url': 'https://facebook.com/317148280440602', 'commenter_id': '100024577680501', 'commenter_url': None, 'commenter_name': 'Kelvin Chan', 'commenter_meta': None, 'comment_text': 'Ang Teck Huat please lo those with booster were lying on hospital now my friend unvax show no symptoms after got it', 'comment_time': datetime.datetime(2022, 3, 27, 0, 0), 'comment_image': None, 'comment_reactors': [], 'comment_reactions': None, 'comment_reaction_count': None}, {'comment_id': '317166600438770', 'comment_url': 'https://facebook.com/317166600438770', 'commenter_id': '1643484934', 'commenter_url': None, 'commenter_name': 'Aaron Yong', 'commenter_meta': None, 'comment_text': ""Ang Teck Huat Read properly. I didn't boost, I coped with the virus very well. No breathing difficulties whatsoever. Oxygen levels were excellent (96% at worst, but that was only because my nose was blocked). Symptoms didn't feel any worse than a typical bad bout of flu/throat infection.\n\nSo yes, nothing to be thankful about in this regard. I didn't take a booster, and, my body just proved to me that it didn't need it too. So my stance remains that the booster is not really necessary for young adults. At least, not so fast (5-6 months in)."", 'comment_time': datetime.datetime(2022, 3, 27, 0, 0), 'comment_image': None, 'comment_reactors': [], 'comment_reactions': None, 'comment_reaction_count': None}, {'comment_id': '317191860436244', 'comment_url': 'https://facebook.com/317191860436244', 'commenter_id': '100003566175899', 'commenter_url': None, 'commenter_name': 'Ang Teck Huat', 'commenter_meta': None, 'comment_text': 'Aaron Yong Sorry. My error. Be thankful for the 2 jabs. Maybe they helped.', 'comment_time': datetime.datetime(2022, 3, 27, 0, 0), 'comment_image': None, 'comment_reactors': [], 'comment_reactions': None, 'comment_reaction_count': None}, {'comment_id': '317225650432865', 'comment_url': 'https://facebook.com/317225650432865', 'commenter_id': '1643484934', 'commenter_url': None, 'commenter_name': 'Aaron Yong', 'commenter_meta': None, 'comment_text': ""Ang Teck Huat yeah for sure. But still, for the 3rd shot, I don't think there's a need to rush for it. My stance is that young adults don't need it so quickly like the MOH is pushing - at least not within the 5 - 7 month range."", 'comment_time': datetime.datetime(2022, 3, 27, 0, 0), 'comment_image': None, 'comment_reactors': [], 'comment_reactions': None, 'comment_reaction_count': None}, {'comment_id': '317269297095167', 'comment_url': 'https://facebook.com/317269297095167', 'commenter_id': '100003566175899', 'commenter_url': None, 'commenter_name': 'Ang Teck Huat', 'commenter_meta': None, 'comment_text': 'Aaron Yong True. Young may be stronger. They may recover on their own. What I am worried is they while they can recover on their own, their aged parents may get the disease from them. And being older, they are at a higher risk. Please protect yourself to protect your loved ones.', 'comment_time': datetime.datetime(2022, 3, 27, 0, 0), 'comment_image': None, 'comment_reactors': [], 'comment_reactions': None, 'comment_reaction_count': None}, {'comment_id': '317628543725909', 'comment_url': 'https://facebook.com/317628543725909', 'commenter_id': '100001992711116', 'commenter_url': None, 'commenter_name': 'Sean Teo', 'commenter_meta': None, 'comment_text': 'Just one simple example, if all the new generation become sick and unfit in the future. So whose will still continue to run the Company?', 'comment_time': datetime.datetime(2022, 3, 27, 0, 0), 'comment_image': None, 'comment_reactors': [], 'comment_reactions': None, 'comment_reaction_count': None}, {'comment_id': '317755890379841', 'comment_url': 'https://facebook.com/317755890379841', 'commenter_id': '701133030', 'commenter_url': None, 'commenter_name': 'Jenny Wong', 'commenter_meta': None, 'comment_text': 'Aaron Yong My friend who get infected was having bad throat infection, until cannot drink and can’t even eat thing. So, Covid is still a serious illness depend on individual. We still need to maintain social distancing and hygiene. Oh ya, my friend is young adult and a lot of my young friends are also serious Covid illness. So don’t underestimate the virus.', 'comment_time': datetime.datetime(2022, 3, 27, 0, 0), 'comment_image': None, 'comment_reactors': [], 'comment_reactions': None, 'comment_reaction_count': None}, {'comment_id': '317906070364823', 'comment_url': 'https://facebook.com/317906070364823', 'commenter_id': '100007542587130', 'commenter_url': None, 'commenter_name': 'Hawken Fox', 'commenter_meta': None, 'comment_text': ""Jenny Wong Cannot eat is not serious lar... Serious is you end up in ICU cannot breath and need oxygen tank and pump... And even then also cannot breath because lung full of water. But hor, young people don't usually get so sick because hor... They have good immune system lar but hor if you have co-morbidities you may not survive lar. BUT GOOD NEW HOR... That's in the past Liao, cos now omicron not so deadly ... Did you check how many are in ICU har?"", 'comment_time': datetime.datetime(2022, 3, 27, 0, 0), 'comment_image': None, 'comment_reactors': [], 'comment_reactions': None, 'comment_reaction_count': None}, {'comment_id': '318230016999095', 'comment_url': 'https://facebook.com/318230016999095', 'commenter_id': '539588667', 'commenter_url': None, 'commenter_name': 'Gwendolyn Yeo', 'commenter_meta': None, 'comment_text': 'Aaron Yong same here. Family of 5 down with delta and my kids have little to no symptoms. We recovered just fine without booster! It’s crap to force ppl take booster that doesn’t work on omicron!', 'comment_time': datetime.datetime(2022, 3, 27, 0, 0), 'comment_image': None, 'comment_reactors': [], 'comment_reactions': None, 'comment_reaction_count': None}, {'comment_id': '320820523406711', 'comment_url': 'https://facebook.com/320820523406711', 'commenter_id': '100071810490095', 'commenter_url': None, 'commenter_name': 'Benjamin Goh', 'commenter_meta': None, 'comment_text': 'Aaron Yong 👍👍👍 I hv this bad flu for 3 weeks since last wk of January 2021, self-isolate at home, no fever, no loss of taste of food, etc. Just continue to drink herbal remedies, drinking more water cos of dry cough. I m still feeling well like normal. The world should send Bill Gates and his buddies to the extreme of dark, outer space n make sure they are not to return to mother Earth!!! PERIOD!!!', 'comment_time': datetime.datetime(2022, 3, 27, 0, 0), 'comment_image': None, 'comment_reactors': [], 'comment_reactions': None, 'comment_reaction_count': None}]"
317084650446965,https://facebook.com/317084650446965,651599076,,Ng Sok Eng,,"MOH guideline: Persons who have recovered from COVID-19 and have completed their primary series vaccination do not require an additional booster dose at this point in time (with no expiry date).
If anyone gets covid, MOH should record and issue discharge memo if you still want to implement VDS. Don't over-medicate by asking people who have acquired natural immunity (especially the mild cases) to go for extra/
unnecessary vaccine shots/boosters.",2022-03-27 00:00:00,,[],,,"[{'comment_id': '317086957113401', 'comment_url': 'https://facebook.com/317086957113401', 'commenter_id': '651599076', 'commenter_url': None, 'commenter_name': 'Ng Sok Eng', 'commenter_meta': None, 'comment_text': 'So the answer to #2, should be No.\nEncouraged, but no need.', 'comment_time': datetime.datetime(2022, 3, 27, 0, 0), 'comment_image': None, 'comment_reactors': [], 'comment_reactions': None, 'comment_reaction_count': None}, {'comment_id': '317807877041309', 'comment_url': 'https://facebook.com/317807877041309', 'commenter_id': '100043906223820', 'commenter_url': None, 'commenter_name': 'Arrissa Naila', 'commenter_meta': None, 'comment_text': ""How if after booster still Kenna covid leh? What's the booster use?"", 'comment_time': datetime.datetime(2022, 3, 27, 0, 0), 'comment_image': None, 'comment_reactors': [], 'comment_reactions': None, 'comment_reaction_count': None}, {'comment_id': '317903440365086', 'comment_url': 'https://facebook.com/317903440365086', 'commenter_id': '100007542587130', 'commenter_url': None, 'commenter_name': 'Hawken Fox', 'commenter_meta': None, 'comment_text': 'Arrissa Naila At this point in time even Israel medical confirms that the vaccine does nothing to stop serious outcomes from covid. 80% of those who are in the ICU are vaccinated. So nope the vaccine did nothing.', 'comment_time': datetime.datetime(2022, 3, 27, 0, 0), 'comment_image': None, 'comment_reactors': [], 'comment_reactions': None, 'comment_reaction_count': None}, {'comment_id': '318111830344247', 'comment_url': 'https://facebook.com/318111830344247', 'commenter_id': '100006043172035', 'commenter_url': None, 'commenter_name': 'YS Lee', 'commenter_meta': None, 'comment_text': 'Ng Sok Eng', 'comment_time': datetime.datetime(2022, 3, 27, 0, 0), 'comment_image': None, 'comment_reactors': [], 'comment_reactions': None, 'comment_reaction_count': None}, {'comment_id': '320817980073632', 'comment_url': 'https://facebook.com/320817980073632', 'commenter_id': '100071810490095', 'commenter_url': None, 'commenter_name': 'Benjamin Goh', 'commenter_meta': None, 'comment_text': 'Ng Sok Eng 👍👍👍👏👏👏 Honest, courageous comments which many Singaporeans have not these days. Why? These sporeans have the answer without further probing. White is white, black is black. No rojak mentality if we, Sporeans, want universal respect!!!!', 'comment_time': datetime.datetime(2022, 3, 27, 0, 0), 'comment_image': None, 'comment_reactors': [], 'comment_reactions': None, 'comment_reaction_count': None}, {'comment_id': '332142858941144', 'comment_url': 'https://facebook.com/332142858941144', 'commenter_id': '661893042', 'commenter_url': None, 'commenter_name': 'Candy Loong', 'commenter_meta': None, 'comment_text': 'Ng Sok Eng in the end they will want us to jab to boost there revenues', 'comment_time': datetime.datetime(2022, 3, 27, 0, 0), 'comment_image': 'https://scontent.fsin15-2.fna.fbcdn.net/v/t39.30808-6/275216403_10159624075993043_1367550492430770438_n.jpg?stp=cp0_dst-jpg_e15_q65_s206x206&_nc_cat=100&ccb=1-7&_nc_sid=1480c5&_nc_ohc=W5dQiwZT0wcAX9gdCWl&_nc_ht=scontent.fsin15-2.fna&oh=00_AfCFkVbGqiPQCNL69RYZ4B1xSe_H_NQkwoFn1y-q49MDhw&oe=6425E653', 'comment_reactors': [], 'comment_reactions': None, 'comment_reaction_count': None}]"
317623407059756,https://facebook.com/317623407059756,1333820839,,Lena Ang,,"My neighbour, live in the same block, 1 got stroke, the other cancer, both after 2 jabs, still ask them to go booster, kill them faster?",2022-03-27 00:00:00,,[],,,"[{'comment_id': '317712663717497', 'comment_url': 'https://facebook.com/317712663717497', 'commenter_id': '719862818', 'commenter_url': None, 'commenter_name': 'Iris Koh', 'commenter_meta': None, 'comment_text': ""Lena Ang I'm so sorry to hear this. Yes, how long do they want to hide from the negative effects of these jabs?"", 'comment_time': datetime.datetime(2022, 3, 27, 0, 0), 'comment_image': None, 'comment_reactors': [], 'comment_reactions': None, 'comment_reaction_count': None}, {'comment_id': '320853660070064', 'comment_url': 'https://facebook.com/320853660070064', 'commenter_id': '100071810490095', 'commenter_url': None, 'commenter_name': 'Benjamin Goh', 'commenter_meta': None, 'comment_text': 'Iris Koh for as long, long as the vaccinated sheepishly conformed without critical thinking. How sad to know that 95% of my fellow sporeans are simply ignorant, fearful or whatever. Are we still proud to be SINGAPOREAN!?', 'comment_time': datetime.datetime(2022, 3, 27, 0, 0), 'comment_image': None, 'comment_reactors': [], 'comment_reactions': None, 'comment_reaction_count': None}]"
317763143712449,https://facebook.com/317763143712449,100010111802875,,Phup,,I already got fourth doses of Covid-19 vaccine 💉😷😷🤒,2022-03-27 00:00:00,,[],,,"[{'comment_id': '320840056738091', 'comment_url': 'https://facebook.com/320840056738091', 'commenter_id': '100071810490095', 'commenter_url': None, 'commenter_name': 'Benjamin Goh', 'commenter_meta': None, 'comment_text': ""Phup A VERY, VERY, VERY, VERY, VERY GOOD LUCK TO YOU. Lets wait n see your future medical conditions. Don't count your chickens before they are hatched. Be realistic cos evidences are aplenty in the world of very possible adverse medical conditions that a human body would face.dont be so ignorant. Dont even believe me. Just Google for the abundance of real info rgd the harmful effects of these experimental vaccines."", 'comment_time': datetime.datetime(2022, 3, 27, 0, 0), 'comment_image': None, 'comment_reactors': [], 'comment_reactions': None, 'comment_reaction_count': None}]"
