comment_id,comment_url,commenter_id,commenter_url,commenter_name,commenter_meta,comment_text,comment_time,comment_image,comment_reactors,comment_reactions,comment_reaction_count,replies
317016333787130,https://facebook.com/317016333787130,100005151937581,,Marissa Teo,,"""...regardless of race, language or religion,...bas
ed on justice an equality...""
We are taught not to discriminate against any race, language or religion. But we discriminate against those who choose not to boost. Is it a just law or an unjust law (as defined by mlk)? The risk/benefit of the booster varies by age and gender. Can't use one size fits all.",2022-03-27 00:00:00,,[],,,"[{'comment_id': '317016633787100', 'comment_url': 'https://facebook.com/317016633787100', 'commenter_id': '100063589865349', 'commenter_url': None, 'commenter_name': 'Jimmy Lam', 'commenter_meta': None, 'comment_text': 'Marissa Teo\nWanna start a freedom convoy like Canada?', 'comment_time': datetime.datetime(2022, 3, 27, 0, 0), 'comment_image': None, 'comment_reactors': [], 'comment_reactions': None, 'comment_reaction_count': None}, {'comment_id': '317017397120357', 'comment_url': 'https://facebook.com/317017397120357', 'commenter_id': '728717079', 'commenter_url': None, 'commenter_name': 'Yap Chia', 'commenter_meta': None, 'comment_text': 'Marissa Teo the whole world must 101% support Pfizer, help Pfizer to make more money, please give us 10 more booster every year to boost our immunity and boost pfizer profit', 'comment_time': datetime.datetime(2022, 3, 27, 0, 0), 'comment_image': None, 'comment_reactors': [], 'comment_reactions': None, 'comment_reaction_count': None}, {'comment_id': '317022443786519', 'comment_url': 'https://facebook.com/317022443786519', 'commenter_id': '100003566175899', 'commenter_url': None, 'commenter_name': 'Ang Teck Huat', 'commenter_meta': None, 'comment_text': ""Marissa Teo let's have 3 million solutions to satisfy 3 million Singaporeans"", 'comment_time': datetime.datetime(2022, 3, 27, 0, 0), 'comment_image': None, 'comment_reactors': [], 'comment_reactions': None, 'comment_reaction_count': None}, {'comment_id': '317022553786508', 'comment_url': 'https://facebook.com/317022553786508', 'commenter_id': '100029804654198', 'commenter_url': None, 'commenter_name': 'Andrew Chan', 'commenter_meta': None, 'comment_text': ""Marissa Teo On one.hand encourage vax to take booster and at the same time discriminate those refuse to take.it. Still there is no choice to enjoy privilege of VDU. Booster is a routine living and maybe out of jobs if u don't continue. No sympathy and empathy till the next election."", 'comment_time': datetime.datetime(2022, 3, 27, 0, 0), 'comment_image': 'https://media1.tenor.co/images/2a487648511ee9bab8dff3a81d70f724/tenor.gif?ver=1112&c=VjFfZmFjZWJvb2tfd2ViY29tbWVudHM&itemid=13997394', 'comment_reactors': [], 'comment_reactions': None, 'comment_reaction_count': None}, {'comment_id': '317025920452838', 'comment_url': 'https://facebook.com/317025920452838', 'commenter_id': '100008323006250', 'commenter_url': None, 'commenter_name': 'Mike Bobby', 'commenter_meta': None, 'comment_text': ""Marissa Teo u know why 官子两个口？ because white n black also them, they say 🐷 is chicken then 🐷is chicken, and don't forget they are loti prata flipping 🤓🤓🤓🤓"", 'comment_time': datetime.datetime(2022, 3, 27, 0, 0), 'comment_image': None, 'comment_reactors': [], 'comment_reactions': None, 'comment_reaction_count': None}, {'comment_id': '317029890452441', 'comment_url': 'https://facebook.com/317029890452441', 'commenter_id': '100005151937581', 'commenter_url': None, 'commenter_name': 'Marissa Teo', 'commenter_meta': None, 'comment_text': ""Ang Teck Huat That's right. Without mandates, all can be satisfied. Those who wish/need can be boosted."", 'comment_time': datetime.datetime(2022, 3, 27, 0, 0), 'comment_image': None, 'comment_reactors': [], 'comment_reactions': None, 'comment_reaction_count': None}, {'comment_id': '317039900451440', 'comment_url': 'https://facebook.com/317039900451440', 'commenter_id': '728674855', 'commenter_url': None, 'commenter_name': 'Ding Hua', 'commenter_meta': None, 'comment_text': 'Andrew Chan Till next election and elect more liars into parliament n turn SG into a joke like other western democracies?', 'comment_time': datetime.datetime(2022, 3, 27, 0, 0), 'comment_image': None, 'comment_reactors': [], 'comment_reactions': None, 'comment_reaction_count': None}, {'comment_id': '317040517118045', 'comment_url': 'https://facebook.com/317040517118045', 'commenter_id': '100003566175899', 'commenter_url': None, 'commenter_name': 'Ang Teck Huat', 'commenter_meta': None, 'comment_text': 'Marissa Teo I am very happy that people like you are not in the administration or holding high post. Otherwise it will spell disasters.', 'comment_time': datetime.datetime(2022, 3, 27, 0, 0), 'comment_image': None, 'comment_reactors': [], 'comment_reactions': None, 'comment_reaction_count': None}, {'comment_id': '317047780450652', 'comment_url': 'https://facebook.com/317047780450652', 'commenter_id': '100000079775716', 'commenter_url': None, 'commenter_name': 'Vincent Koh', 'commenter_meta': None, 'comment_text': 'Marissa Teo - we done! Can recite the national pledge… but do you understand it’s meaning. Surely freedom from being harmed by high risk people spreading a disease or the risk posed by people rejecting Public Safety must be implied in the pledge! Do you need to be made to understand the spirit of the pledge is social harmony as best as we possibly can! Risking and causing illness to people who do not wish to be hurt is not at all discrimination but a matter of PUBLIC SAFETY! One choose to live in an alternate is fine as long as it does not risk, threaten and cause harm to others!\n\nFREEDOM COMES WITH RESPONSIBILITY!\n\nIs always sound nice when making motherhood statement!', 'comment_time': datetime.datetime(2022, 3, 27, 0, 0), 'comment_image': None, 'comment_reactors': [], 'comment_reactions': None, 'comment_reaction_count': None}, {'comment_id': '317054407116656', 'comment_url': 'https://facebook.com/317054407116656', 'commenter_id': '100005151937581', 'commenter_url': None, 'commenter_name': 'Marissa Teo', 'commenter_meta': None, 'comment_text': 'Vincent Koh Fully agree with you. But this vaccine does not provide sterilizing immunity.', 'comment_time': datetime.datetime(2022, 3, 27, 0, 0), 'comment_image': None, 'comment_reactors': [], 'comment_reactions': None, 'comment_reaction_count': None}, {'comment_id': '317055223783241', 'comment_url': 'https://facebook.com/317055223783241', 'commenter_id': '728674855', 'commenter_url': None, 'commenter_name': 'Ding Hua', 'commenter_meta': None, 'comment_text': 'Marissa Teo does the flu vaccines we take provide sterilising immunity?\n\nThe best 60% for flu vaccine', 'comment_time': datetime.datetime(2022, 3, 27, 0, 0), 'comment_image': None, 'comment_reactors': [], 'comment_reactions': None, 'comment_reaction_count': None}, {'comment_id': '317103353778428', 'comment_url': 'https://facebook.com/317103353778428', 'commenter_id': '100029804654198', 'commenter_url': None, 'commenter_name': 'Andrew Chan', 'commenter_meta': None, 'comment_text': 'Marissa Teo No more high risk even the vax infected aft boost. Now 90% vax but booster not fully taken due to personal reasons. Omicron highly infected who to be blame. Vax or unvax so do not discriminate . Your body your choice.', 'comment_time': datetime.datetime(2022, 3, 27, 0, 0), 'comment_image': 'https://media1.tenor.co/images/c176a39ded9ae50c94af6776ba63e433/tenor.gif?ver=1112&c=VjFfZmFjZWJvb2tfd2ViY29tbWVudHM&itemid=16847933', 'comment_reactors': [], 'comment_reactions': None, 'comment_reaction_count': None}, {'comment_id': '317105023778261', 'comment_url': 'https://facebook.com/317105023778261', 'commenter_id': '100029804654198', 'commenter_url': None, 'commenter_name': 'Andrew Chan', 'commenter_meta': None, 'comment_text': 'Ding Hua People notice how debate handle in parliament n the next.time who got the more said. Hoping balance 2 parties\nSo think carefully. 🤣', 'comment_time': datetime.datetime(2022, 3, 27, 0, 0), 'comment_image': 'https://media1.tenor.co/images/dfd4e06dc170cb8dad94cddb6d941e33/tenor.gif?ver=1112&c=VjFfZmFjZWJvb2tfd2ViY29tbWVudHM&itemid=22777727', 'comment_reactors': [], 'comment_reactions': None, 'comment_reaction_count': None}, {'comment_id': '317118410443589', 'comment_url': 'https://facebook.com/317118410443589', 'commenter_id': '728674855', 'commenter_url': None, 'commenter_name': 'Ding Hua', 'commenter_meta': None, 'comment_text': 'Andrew Chan yeah. I support to vote more liars n oppositions just to make PAP lose at any cost to Singapore n Singaporeans including the generations to come.\n\nThe generations yet to come will look at us in amaze. How dumb can we get... Cut off our hands to snub the body.\n\nCheers', 'comment_time': datetime.datetime(2022, 3, 27, 0, 0), 'comment_image': None, 'comment_reactors': [], 'comment_reactions': None, 'comment_reaction_count': None}, {'comment_id': '317121633776600', 'comment_url': 'https://facebook.com/317121633776600', 'commenter_id': '100029804654198', 'commenter_url': None, 'commenter_name': 'Andrew Chan', 'commenter_meta': None, 'comment_text': 'Ding Hua If u have no.individual choice u have no freedom and as.free as a bird but not cage.\nJust like election.', 'comment_time': datetime.datetime(2022, 3, 27, 0, 0), 'comment_image': 'https://media2.giphy.com/media/v1.Y2lkPTEyMGMwMTQ3dWxxbjNjajV6OWdxYnBzMnh3a3kzZDl6ZW1lOXdqdTdkM2tvaWYxaCZjdD1n/26AHLspJScv2J6P0k/giphy.gif', 'comment_reactors': [], 'comment_reactions': None, 'comment_reaction_count': None}, {'comment_id': '317722500383180', 'comment_url': 'https://facebook.com/317722500383180', 'commenter_id': '1036641823', 'commenter_url': None, 'commenter_name': 'Charis Chan', 'commenter_meta': None, 'comment_text': ""Vincent Koh In that case anyone who has an infectious disease should have vds applied on them. So all those who don't take the flu shot, or the chicken pox shot or the shingles shot, TB shot, etc should not be allowed in shopping malls, dine in etc just like those who do not want to take the covid shot."", 'comment_time': datetime.datetime(2022, 3, 27, 0, 0), 'comment_image': None, 'comment_reactors': [], 'comment_reactions': None, 'comment_reaction_count': None}, {'comment_id': '320864706735626', 'comment_url': 'https://facebook.com/320864706735626', 'commenter_id': '100071810490095', 'commenter_url': None, 'commenter_name': 'Benjamin Goh', 'commenter_meta': None, 'comment_text': 'Marissa Teo Covid advisory is not a law as it was n has not been debated in Parliament till now, 14/2/20222. Govt has worded it very intelligently such that employers, etc read n understand it to be a law related to Covid. Govt is not liable cos it is labelled as Covid Advisory. Pls read carefully.', 'comment_time': datetime.datetime(2022, 3, 27, 0, 0), 'comment_image': None, 'comment_reactors': [], 'comment_reactions': None, 'comment_reaction_count': None}]"
317056410449789,https://facebook.com/317056410449789,716895507,,Jun Yu Ong,,Yes.. i know boosters provide better protection.. from official harrassment not covid... until they decide 4th booster is required.. 😁,2022-03-27 00:00:00,,[],,,"[{'comment_id': '317616573727106', 'comment_url': 'https://facebook.com/317616573727106', 'commenter_id': '617091525', 'commenter_url': None, 'commenter_name': 'Pri Ya', 'commenter_meta': None, 'comment_text': 'Jun Yu Ong this is a fantastic way of putting it. We need to keep jabbing ourselves so the ‘expert panel’ of God-knows-who can feel better about the alleged “science” they are absorbing from God-knows-where\n.\n\nSeems as though “Singapore-expe\nrt-panel-scienc\ne” is different from the science from Norway, Sweden, Iceland all which are NOT allowing their children to be jabbed.\n\nThese are not vaccines. Anyone can see this.\n\n#EnoughIsEnough', 'comment_time': datetime.datetime(2022, 3, 27, 0, 0), 'comment_image': None, 'comment_reactors': [], 'comment_reactions': None, 'comment_reaction_count': None}, {'comment_id': '317727843715979', 'comment_url': 'https://facebook.com/317727843715979', 'commenter_id': '1036641823', 'commenter_url': None, 'commenter_name': 'Charis Chan', 'commenter_meta': None, 'comment_text': 'Pri Ya You mean NOT allowing?', 'comment_time': datetime.datetime(2022, 3, 27, 0, 0), 'comment_image': None, 'comment_reactors': [], 'comment_reactions': None, 'comment_reaction_count': None}, {'comment_id': '317734613715302', 'comment_url': 'https://facebook.com/317734613715302', 'commenter_id': '617091525', 'commenter_url': None, 'commenter_name': 'Pri Ya', 'commenter_meta': None, 'comment_text': 'Charis Chan yes. Thank you. Corrected it. 🌱', 'comment_time': datetime.datetime(2022, 3, 27, 0, 0), 'comment_image': None, 'comment_reactors': [], 'comment_reactions': None, 'comment_reaction_count': None}, {'comment_id': '318230736999023', 'comment_url': 'https://facebook.com/318230736999023', 'commenter_id': '539588667', 'commenter_url': None, 'commenter_name': 'Gwendolyn Yeo', 'commenter_meta': None, 'comment_text': 'Jun Yu Ong likely. Soon year end . Latest new Pfizer come out with omicron vaccine now 😂', 'comment_time': datetime.datetime(2022, 3, 27, 0, 0), 'comment_image': None, 'comment_reactors': [], 'comment_reactions': None, 'comment_reaction_count': None}, {'comment_id': '320866986735398', 'comment_url': 'https://facebook.com/320866986735398', 'commenter_id': '100071810490095', 'commenter_url': None, 'commenter_name': 'Benjamin Goh', 'commenter_meta': None, 'comment_text': 'Jun Yu Ong any REAL PROOFS that govt leaders n advocating officials have the boosters? Hear this: the leader will stay at the rear after commanding his foot soldiers to charge at the enemies. This type of leader is called the ""STEALTHY"" one.', 'comment_time': datetime.datetime(2022, 3, 27, 0, 0), 'comment_image': None, 'comment_reactors': [], 'comment_reactions': None, 'comment_reaction_count': None}]"
317035010451929,https://facebook.com/317035010451929,100068896041856,,Hartley Hartley,,"Nonsense booster, mostly possitive now a days are those who taken their booster,🤔😷😪",2022-03-27 00:00:00,,[],,,"[{'comment_id': '317066523782111', 'comment_url': 'https://facebook.com/317066523782111', 'commenter_id': '100005191538136', 'commenter_url': None, 'commenter_name': '星月之海', 'commenter_meta': None, 'comment_text': 'Hartley Hartley Getting more 😂', 'comment_time': datetime.datetime(2022, 3, 27, 0, 0), 'comment_image': None, 'comment_reactors': [], 'comment_reactions': None, 'comment_reaction_count': None}, {'comment_id': '317066867115410', 'comment_url': 'https://facebook.com/317066867115410', 'commenter_id': '100068896041856', 'commenter_url': None, 'commenter_name': 'Hartley Hartley', 'commenter_meta': None, 'comment_text': '星月之海 I almost believe 🤣🤣🤣🤣', 'comment_time': datetime.datetime(2022, 3, 27, 0, 0), 'comment_image': None, 'comment_reactors': [], 'comment_reactions': None, 'comment_reaction_count': None}, {'comment_id': '320870683401695', 'comment_url': 'https://facebook.com/320870683401695', 'commenter_id': '100071810490095', 'commenter_url': None, 'commenter_name': 'Benjamin Goh', 'commenter_meta': None, 'comment_text': 'Hartley Hartley Do you why? Cos the booster jab or jabs weakens/weaken your natural immunity. Logical????', 'comment_time': datetime.datetime(2022, 3, 27, 0, 0), 'comment_image': None, 'comment_reactors': [], 'comment_reactions': None, 'comment_reaction_count': None}, {'comment_id': '320871906734906', 'comment_url': 'https://facebook.com/320871906734906', 'commenter_id': '100071810490095', 'commenter_url': None, 'commenter_name': 'Benjamin Goh', 'commenter_meta': None, 'comment_text': '星月之海 what is the actual meaning of booster? Boost means to strengthen. So how does one get reinfected after boosters. It logically means that the supposed boosters weaken your body natural immune system.', 'comment_time': datetime.datetime(2022, 3, 27, 0, 0), 'comment_image': None, 'comment_reactors': [], 'comment_reactions': None, 'comment_reaction_count': None}, {'comment_id': '321056160049814', 'comment_url': 'https://facebook.com/321056160049814', 'commenter_id': '100005191538136', 'commenter_url': None, 'commenter_name': '星月之海', 'commenter_meta': None, 'comment_text': 'Totally agreed, this morning, one of my elder colleague, alr taken mRNA booster last year, received protocol 1 from MOH, to be home isolation for 10 days (quite serious), I asked the rest of my colleagues, all this booster for what? But my Mgr said, booster will protect u from death or serious condition, lol 😂, I said u talk like 4g, win liao.', 'comment_time': datetime.datetime(2022, 3, 27, 0, 0), 'comment_image': None, 'comment_reactors': [], 'comment_reactions': None, 'comment_reaction_count': None}]"
317037333785030,https://facebook.com/317037333785030,632786210,,Aurelia Elena,,Can explain why 9 months to boost and not 12 months? Any stats to show? Annual boost is easier to convince ppl. Bring in Novavax pls....,2022-03-27 00:00:00,,[],,,"[{'comment_id': '317742870381143', 'comment_url': 'https://facebook.com/317742870381143', 'commenter_id': '767857860', 'commenter_url': None, 'commenter_name': 'Deborah Seet', 'commenter_meta': None, 'comment_text': 'Aurelia Elena Novavax is also a poison. A secret MrNA under skin.', 'comment_time': datetime.datetime(2022, 3, 27, 0, 0), 'comment_image': None, 'comment_reactors': [], 'comment_reactions': None, 'comment_reaction_count': None}]"
317038070451623,https://facebook.com/317038070451623,100070762688493,,KB WR,,Lousy booster. Get booster Liao still kena covid. Ffs we get booster for.,2022-03-27 00:00:00,,[],,,"[{'comment_id': '317616920393738', 'comment_url': 'https://facebook.com/317616920393738', 'commenter_id': '617091525', 'commenter_url': None, 'commenter_name': 'Pri Ya', 'commenter_meta': None, 'comment_text': 'KB Wr this is the question not only for the booster but for the original two jabs. Can they answer? No. What do they do instead? Force the innocent children to take poison jabs when there is no need for them to.', 'comment_time': datetime.datetime(2022, 3, 27, 0, 0), 'comment_image': None, 'comment_reactors': [], 'comment_reactions': None, 'comment_reaction_count': None}, {'comment_id': '317630083725755', 'comment_url': 'https://facebook.com/317630083725755', 'commenter_id': '100012302478155', 'commenter_url': None, 'commenter_name': 'Heng Teng Tan', 'commenter_meta': None, 'comment_text': 'So who is making money from the booster even you still get infected???', 'comment_time': datetime.datetime(2022, 3, 27, 0, 0), 'comment_image': None, 'comment_reactors': [], 'comment_reactions': None, 'comment_reaction_count': None}]"
317021873786576,https://facebook.com/317021873786576,100027222527780,,Pak Adam,,"Still playing the broken record as more confirmation news comes True. Slow. Very slow.
Unlike the SINGAPORE system of ahead of everybody...",2022-03-27 00:00:00,,[],,,"[{'comment_id': '320858243402939', 'comment_url': 'https://facebook.com/320858243402939', 'commenter_id': '100071810490095', 'commenter_url': None, 'commenter_name': 'Benjamin Goh', 'commenter_meta': None, 'comment_text': 'Pak Adam Spore ahead is not the correct words. Should be: Spore system is very hideous, very STEALTHY. This is the honest truth, I dont minced my words.', 'comment_time': datetime.datetime(2022, 3, 27, 0, 0), 'comment_image': None, 'comment_reactors': [], 'comment_reactions': None, 'comment_reaction_count': None}, {'comment_id': '320861313402632', 'comment_url': 'https://facebook.com/320861313402632', 'commenter_id': '100027222527780', 'commenter_url': None, 'commenter_name': 'Pak Adam', 'commenter_meta': None, 'comment_text': 'Benjamin Goh After much thoughts, we only have One government. YES. Things are just not right. But some things are. Example separating the Un-Vax and the Vax. Think on that slowly.\nWe are kept apart to safeguard one group. Thanks.', 'comment_time': datetime.datetime(2022, 3, 27, 0, 0), 'comment_image': None, 'comment_reactors': [], 'comment_reactions': None, 'comment_reaction_count': None}]"
